{
  "schema_version": "1.0.0",
  "id": "cal-0001",
  "sensor_id": "mic1",
  "quantity": "sound_pressure",
  "sensitivity_fs_per_unit": 0.0213,
  "reference_freq_hz": 1000.0,
  "reference_gain_db": 30.0,
  "fr_correction": [
    {
      "freq_hz": 20.0,
      "correction_db": 1.5
    },
    {
      "freq_hz": 1000.0,
      "correction_db": 0.0
    }
  ],
  "valid_band_hz": [
    20.0,
    20000.0
  ],
  "uncertainty_db": 0.45,
  "method": "calibrator",
  "source_capture_id": "cap-0123456789ab",
  "device_name": "",
  "created_utc": "2026-10-12T12:00:00Z",
  "notes": ""
}
